[dotenv@17.2.3] injecting env (0) from .env.local -- tip: ✅ audit secrets and track compliance: https://dotenvx.com/ops
================================================================================
Generating Initial Test Question Set (~50 questions)
================================================================================


================================================================================
Generating: Cryptography Topics (Bloom 2-3)
================================================================================

================================================================================
Batch Question Generation
================================================================================

 Step 1: Retrieving entities...
Fetching entities for scope tag: cryptography
✅ Found 10 entities to process

🤖 Step 2: Generating questions...

────────────────────────────────────────────────────────────────────────────────
Batch 1/2 (Entities 1-5)

  Entity: Technical (Subtopic)
    Generating: Bloom 2 - mcq_single
    ✅ Generated (656 tokens, $0.004800)
Error storing question: {
  code: '23514',
  details: 'Failing row contains (358846d9-6dd1-49ad-b70a-f4c1d0bd5cbd, null, 2, A security administrator needs to classify various security cont..., multiple_choice, ["A) They are implemented through technology-based mechanisms su..., A, Option A is correct because technical security controls are spec..., {"entityId":"2514cc49-7f0e-4a87-a7a8-2dbc44fb1cde","entityName":..., easy, 0, null, 2025-11-14 23:54:38.886282+00, 2025-11-14 23:54:38.886282+00, null, null, null, ai_generated_graphrag, null, {}, {"primary": 1.0, "secondary": []}, null, mcq_single, {}, null, {}, {}, 2514cc49-7f0e-4a87-a7a8-2dbc44fb1cde, Technical, General Security Concepts, General Security Concepts > Compare and contrast various types o..., 656, 0.004800, claude-sonnet-4-20250514, null).',
  hint: null,
  message: 'new row for relation "questions" violates check constraint "check_has_topic"'
}
    ❌ Storage failed: new row for relation "questions" violates check constraint "check_has_topic"
    Generating: Bloom 2 - true_false
    ✅ Generated (441 tokens, $0.002751)
Error storing question: {
  code: '23514',
  details: 'Failing row contains (24d21687-f6ba-40e0-bc22-4e66506110b5, null, 2, Technical security controls require human intervention to enforc..., true_false, null, False, This statement is false because technical security controls are ..., {"entityId":"2514cc49-7f0e-4a87-a7a8-2dbc44fb1cde","entityName":..., easy, 0, null, 2025-11-14 23:54:47.00453+00, 2025-11-14 23:54:47.00453+00, null, null, null, ai_generated_graphrag, null, {}, {"primary": 1.0, "secondary": []}, null, true_false, {}, null, {}, {}, 2514cc49-7f0e-4a87-a7a8-2dbc44fb1cde, Technical, General Security Concepts, General Security Concepts > Compare and contrast various types o..., 441, 0.002751, claude-sonnet-4-20250514, null).',
  hint: null,
  message: 'new row for relation "questions" violates check constraint "check_has_topic"'
}
    ❌ Storage failed: new row for relation "questions" violates check constraint "check_has_topic"
    Generating: Bloom 3 - mcq_single
    ✅ Generated (661 tokens, $0.004983)
Error storing question: {
  code: '23514',
  details: 'Failing row contains (0e314a86-2422-4ce5-9e49-10dd813dfe85, null, 3, A company needs to implement technical controls to prevent unaut..., multiple_choice, ["A) Access Control Lists (ACLs) configured on network servers",..., A, Access Control Lists (ACLs) are the correct technical control to..., {"entityId":"2514cc49-7f0e-4a87-a7a8-2dbc44fb1cde","entityName":..., medium, 0, null, 2025-11-14 23:54:59.12606+00, 2025-11-14 23:54:59.12606+00, null, null, null, ai_generated_graphrag, null, {}, {"primary": 1.0, "secondary": []}, null, mcq_single, {}, null, {}, {}, 2514cc49-7f0e-4a87-a7a8-2dbc44fb1cde, Technical, General Security Concepts, General Security Concepts > Compare and contrast various types o..., 661, 0.004983, claude-sonnet-4-20250514, null).',
  hint: null,
  message: 'new row for relation "questions" violates check constraint "check_has_topic"'
}
    ❌ Storage failed: new row for relation "questions" violates check constraint "check_has_topic"
    Generating: Bloom 3 - true_false
    ✅ Generated (459 tokens, $0.003093)
Error storing question: {
  code: '23514',
  details: 'Failing row contains (4f33c8b4-44dc-4fad-a738-f634aee73374, null, 3, A security administrator implementing a biometric authentication..., true_false, null, True, This statement is true because biometric authentication systems ..., {"entityId":"2514cc49-7f0e-4a87-a7a8-2dbc44fb1cde","entityName":..., medium, 0, null, 2025-11-14 23:55:08.758634+00, 2025-11-14 23:55:08.758634+00, null, null, null, ai_generated_graphrag, null, {}, {"primary": 1.0, "secondary": []}, null, true_false, {}, null, {}, {}, 2514cc49-7f0e-4a87-a7a8-2dbc44fb1cde, Technical, General Security Concepts, General Security Concepts > Compare and contrast various types o..., 459, 0.003093, claude-sonnet-4-20250514, null).',
  hint: null,
  message: 'new row for relation "questions" violates check constraint "check_has_topic"'
}
    ❌ Storage failed: new row for relation "questions" violates check constraint "check_has_topic"

  Entity: Compensating (Subtopic)
    Generating: Bloom 2 - mcq_single
    ✅ Generated (659 tokens, $0.004749)
Error storing question: {
  code: '23514',
  details: 'Failing row contains (8401bd08-03cb-4790-ba45-779ce1fd9eaa, null, 2, A company cannot implement full disk encryption on legacy system..., multiple_choice, ["A) Compensating control", "B) Detective control", "C) Correcti..., A, Option A is correct because compensating controls are alternativ..., {"entityId":"2bbea9be-b63e-48ff-bd81-0ad08ce1e1ab","entityName":..., easy, 0, null, 2025-11-14 23:55:20.60509+00, 2025-11-14 23:55:20.60509+00, null, null, null, ai_generated_graphrag, null, {}, {"primary": 1.0, "secondary": []}, null, mcq_single, {}, null, {}, {}, 2bbea9be-b63e-48ff-bd81-0ad08ce1e1ab, Compensating, General Security Concepts, General Security Concepts > Compare and contrast various types o..., 659, 0.004749, claude-sonnet-4-20250514, null).',
  hint: null,
  message: 'new row for relation "questions" violates check constraint "check_has_topic"'
}
    ❌ Storage failed: new row for relation "questions" violates check constraint "check_has_topic"
    Generating: Bloom 2 - true_false
    ✅ Generated (470 tokens, $0.003090)
Error storing question: {
  code: '23514',
  details: 'Failing row contains (fb5a190a-3893-4e02-aa28-2636b61fb6ba, null, 2, Compensating controls are implemented as temporary workarounds w..., true_false, null, False, This statement is false because compensating controls are not ne..., {"entityId":"2bbea9be-b63e-48ff-bd81-0ad08ce1e1ab","entityName":..., easy, 0, null, 2025-11-14 23:55:30.448533+00, 2025-11-14 23:55:30.448533+00, null, null, null, ai_generated_graphrag, null, {}, {"primary": 1.0, "secondary": []}, null, true_false, {}, null, {}, {}, 2bbea9be-b63e-48ff-bd81-0ad08ce1e1ab, Compensating, General Security Concepts, General Security Concepts > Compare and contrast various types o..., 470, 0.003090, claude-sonnet-4-20250514, null).',
  hint: null,
  message: 'new row for relation "questions" violates check constraint "check_has_topic"'
}
    ❌ Storage failed: new row for relation "questions" violates check constraint "check_has_topic"
    Generating: Bloom 3 - mcq_single
    ✅ Generated (686 tokens, $0.005262)
Error storing question: {
  code: '23514',
  details: `Failing row contains (adb56727-a32c-491e-a7cc-8e6f90fa7427, null, 3, A company's legacy database system cannot support modern encrypt..., multiple_choice, ["A) Deploy network segmentation with strict access controls and..., A, Option A is correct because network segmentation with strict acc..., {"entityId":"2bbea9be-b63e-48ff-bd81-0ad08ce1e1ab","entityName":..., medium, 0, null, 2025-11-14 23:55:42.669604+00, 2025-11-14 23:55:42.669604+00, null, null, null, ai_generated_graphrag, null, {}, {"primary": 1.0, "secondary": []}, null, mcq_single, {}, null, {}, {}, 2bbea9be-b63e-48ff-bd81-0ad08ce1e1ab, Compensating, General Security Concepts, General Security Concepts > Compare and contrast various types o..., 686, 0.005262, claude-sonnet-4-20250514, null).`,
  hint: null,
  message: 'new row for relation "questions" violates check constraint "check_has_topic"'
}
    ❌ Storage failed: new row for relation "questions" violates check constraint "check_has_topic"
    Generating: Bloom 3 - true_false
    ✅ Generated (480 tokens, $0.003312)
Error storing question: {
  code: '23514',
  details: 'Failing row contains (b3afe7a5-c1c4-449c-aa51-44599195481a, null, 3, A company that cannot implement full disk encryption on legacy s..., true_false, null, True, This statement is true because it demonstrates a proper applicat..., {"entityId":"2bbea9be-b63e-48ff-bd81-0ad08ce1e1ab","entityName":..., medium, 0, null, 2025-11-14 23:55:52.514531+00, 2025-11-14 23:55:52.514531+00, null, null, null, ai_generated_graphrag, null, {}, {"primary": 1.0, "secondary": []}, null, true_false, {}, null, {}, {}, 2bbea9be-b63e-48ff-bd81-0ad08ce1e1ab, Compensating, General Security Concepts, General Security Concepts > Compare and contrast various types o..., 480, 0.003312, claude-sonnet-4-20250514, null).',
  hint: null,
  message: 'new row for relation "questions" violates check constraint "check_has_topic"'
}
    ❌ Storage failed: new row for relation "questions" violates check constraint "check_has_topic"

  Entity: Preventive (Subtopic)
    Generating: Bloom 2 - mcq_single
    ✅ Generated (663 tokens, $0.004701)
Error storing question: {
  code: '23514',
  details: 'Failing row contains (40f4701e-1966-4c25-8b85-dd7a4f7d30bf, null, 2, A security administrator is implementing measures to stop potent..., multiple_choice, ["A) They proactively block threats and eliminate vulnerabilitie..., A, Option A is correct because preventive security controls are spe..., {"entityId":"1c4bb14d-5eac-4e1f-b3a2-69b0d5bb8794","entityName":..., easy, 0, null, 2025-11-14 23:56:02.761905+00, 2025-11-14 23:56:02.761905+00, null, null, null, ai_generated_graphrag, null, {}, {"primary": 1.0, "secondary": []}, null, mcq_single, {}, null, {}, {}, 1c4bb14d-5eac-4e1f-b3a2-69b0d5bb8794, Preventive, General Security Concepts, General Security Concepts > Compare and contrast various types o..., 663, 0.004701, claude-sonnet-4-20250514, null).',
  hint: null,
  message: 'new row for relation "questions" violates check constraint "check_has_topic"'
}
    ❌ Storage failed: new row for relation "questions" violates check constraint "check_has_topic"
    Generating: Bloom 2 - true_false
    ✅ Generated (498 tokens, $0.003402)
Error storing question: {
  code: '23514',
  details: 'Failing row contains (aa1899a1-a043-4e9f-ba14-2311799cb1f3, null, 2, Preventive security controls are designed to stop security incid..., true_false, null, True, This statement is true because preventive security controls are ..., {"entityId":"1c4bb14d-5eac-4e1f-b3a2-69b0d5bb8794","entityName":..., easy, 0, null, 2025-11-14 23:56:11.559656+00, 2025-11-14 23:56:11.559656+00, null, null, null, ai_generated_graphrag, null, {}, {"primary": 1.0, "secondary": []}, null, true_false, {}, null, {}, {}, 1c4bb14d-5eac-4e1f-b3a2-69b0d5bb8794, Preventive, General Security Concepts, General Security Concepts > Compare and contrast various types o..., 498, 0.003402, claude-sonnet-4-20250514, null).',
  hint: null,
  message: 'new row for relation "questions" violates check constraint "check_has_topic"'
}
    ❌ Storage failed: new row for relation "questions" violates check constraint "check_has_topic"
    Generating: Bloom 3 - mcq_single
    ✅ Generated (723 tokens, $0.005709)
Error storing question: {
  code: '23514',
  details: 'Failing row contains (eb9bd5e1-693b-45e4-a488-cf59f9548c31, null, 3, A financial services company wants to implement preventive secur..., multiple_choice, ["A) Implementing TLS encryption for data in transit and role-ba..., A, Option A is correct because it demonstrates the application of t..., {"entityId":"1c4bb14d-5eac-4e1f-b3a2-69b0d5bb8794","entityName":..., medium, 0, null, 2025-11-14 23:56:23.6672+00, 2025-11-14 23:56:23.6672+00, null, null, null, ai_generated_graphrag, null, {}, {"primary": 1.0, "secondary": []}, null, mcq_single, {}, null, {}, {}, 1c4bb14d-5eac-4e1f-b3a2-69b0d5bb8794, Preventive, General Security Concepts, General Security Concepts > Compare and contrast various types o..., 723, 0.005709, claude-sonnet-4-20250514, null).',
  hint: null,
  message: 'new row for relation "questions" violates check constraint "check_has_topic"'
}
    ❌ Storage failed: new row for relation "questions" violates check constraint "check_has_topic"
    Generating: Bloom 3 - true_false
    ✅ Generated (490 tokens, $0.003354)
Error storing question: {
  code: '23514',
  details: 'Failing row contains (543b77e2-c61f-4685-b750-a65f479bbfd5, null, 3, A security administrator implements multi-factor authentication,..., true_false, null, True, This statement is true because all three measures described are ..., {"entityId":"1c4bb14d-5eac-4e1f-b3a2-69b0d5bb8794","entityName":..., medium, 0, null, 2025-11-14 23:56:32.645224+00, 2025-11-14 23:56:32.645224+00, null, null, null, ai_generated_graphrag, null, {}, {"primary": 1.0, "secondary": []}, null, true_false, {}, null, {}, {}, 1c4bb14d-5eac-4e1f-b3a2-69b0d5bb8794, Preventive, General Security Concepts, General Security Concepts > Compare and contrast various types o..., 490, 0.003354, claude-sonnet-4-20250514, null).',
  hint: null,
  message: 'new row for relation "questions" violates check constraint "check_has_topic"'
}
    ❌ Storage failed: new row for relation "questions" violates check constraint "check_has_topic"

  Entity: Technical implications (Topic)
    Generating: Bloom 2 - mcq_single
    ✅ Generated (1350 tokens, $0.007578)
Error storing question: {
  code: '23514',
  details: 'Failing row contains (3600cf72-6e14-49a7-8b71-e0a6a07b9972, null, 2, A security team is planning to update their firewall configurati..., multiple_choice, ["A) Updating allow lists to include newly approved applications..., A, Option A is correct because updating allow lists to include newl..., {"entityId":"f1a12e5b-a904-4fec-9687-7ec491da8202","entityName":..., easy, 0, null, 2025-11-14 23:56:45.791572+00, 2025-11-14 23:56:45.791572+00, null, null, null, ai_generated_graphrag, null, {}, {"primary": 1.0, "secondary": []}, null, mcq_single, {}, null, {}, {}, f1a12e5b-a904-4fec-9687-7ec491da8202, Technical implications, General Security Concepts, General Security Concepts > Explain the importance of change man..., 1350, 0.007578, claude-sonnet-4-20250514, null).',
  hint: null,
  message: 'new row for relation "questions" violates check constraint "check_has_topic"'
}
    ❌ Storage failed: new row for relation "questions" violates check constraint "check_has_topic"
    Generating: Bloom 2 - true_false
    ✅ Generated (1094 tokens, $0.004914)
Error storing question: {
  code: '23514',
  details: 'Failing row contains (82f4d426-cfc2-4fb2-8c3a-f92d12623e2a, null, 2, During change management implementation, restricting concurrent ..., true_false, null, True, This statement is true because restricted activities are a key t..., {"entityId":"f1a12e5b-a904-4fec-9687-7ec491da8202","entityName":..., easy, 0, null, 2025-11-14 23:56:53.883047+00, 2025-11-14 23:56:53.883047+00, null, null, null, ai_generated_graphrag, null, {}, {"primary": 1.0, "secondary": []}, null, true_false, {}, null, {}, {}, f1a12e5b-a904-4fec-9687-7ec491da8202, Technical implications, General Security Concepts, General Security Concepts > Explain the importance of change man..., 1094, 0.004914, claude-sonnet-4-20250514, null).',
  hint: null,
  message: 'new row for relation "questions" violates check constraint "check_has_topic"'
}
    ❌ Storage failed: new row for relation "questions" violates check constraint "check_has_topic"
    Generating: Bloom 3 - mcq_single
    ✅ Generated (1334 tokens, $0.007446)
Error storing question: {
  code: '23514',
  details: `Failing row contains (2803e82c-42b1-4736-b47a-09347ad33c89, null, 3, A financial organization is implementing a new web application f..., multiple_choice, ["A) Update the allow lists to include the new WAF's IP addresse..., A, Option A is correct because updating allow lists to include the ..., {"entityId":"f1a12e5b-a904-4fec-9687-7ec491da8202","entityName":..., medium, 0, null, 2025-11-14 23:57:06.937248+00, 2025-11-14 23:57:06.937248+00, null, null, null, ai_generated_graphrag, null, {}, {"primary": 1.0, "secondary": []}, null, mcq_single, {}, null, {}, {}, f1a12e5b-a904-4fec-9687-7ec491da8202, Technical implications, General Security Concepts, General Security Concepts > Explain the importance of change man..., 1334, 0.007446, claude-sonnet-4-20250514, null).`,
  hint: null,
  message: 'new row for relation "questions" violates check constraint "check_has_topic"'
}
    ❌ Storage failed: new row for relation "questions" violates check constraint "check_has_topic"
    Generating: Bloom 3 - true_false
    ✅ Generated (1108 tokens, $0.005196)
Error storing question: {
  code: '23514',
  details: 'Failing row contains (8fbce820-6247-4d2a-a266-d2f6a8f07653, null, 3, When implementing a security patch that requires service restart..., true_false, null, True, This statement is true because dependency mapping is a critical ..., {"entityId":"f1a12e5b-a904-4fec-9687-7ec491da8202","entityName":..., medium, 0, null, 2025-11-14 23:57:17.038058+00, 2025-11-14 23:57:17.038058+00, null, null, null, ai_generated_graphrag, null, {}, {"primary": 1.0, "secondary": []}, null, true_false, {}, null, {}, {}, f1a12e5b-a904-4fec-9687-7ec491da8202, Technical implications, General Security Concepts, General Security Concepts > Explain the importance of change man..., 1108, 0.005196, claude-sonnet-4-20250514, null).',
  hint: null,
  message: 'new row for relation "questions" violates check constraint "check_has_topic"'
}
    ❌ Storage failed: new row for relation "questions" violates check constraint "check_has_topic"

  Entity: Dependencies (Subtopic)
    Generating: Bloom 2 - mcq_single
    ✅ Generated (651 tokens, $0.004677)
Error storing question: {
  code: '23514',
  details: 'Failing row contains (22c03e3b-3f56-4c46-9664-10975ef0c206, null, 2, A security administrator needs to explain why dependency mapping..., multiple_choice, ["A) To identify relationships between systems so changes can be..., A, Option A is correct because dependency mapping specifically iden..., {"entityId":"50a72f25-d537-4c25-b767-0ce87620653d","entityName":..., easy, 0, null, 2025-11-14 23:57:28.780528+00, 2025-11-14 23:57:28.780528+00, null, null, null, ai_generated_graphrag, null, {}, {"primary": 1.0, "secondary": []}, null, mcq_single, {}, null, {}, {}, 50a72f25-d537-4c25-b767-0ce87620653d, Dependencies, General Security Concepts, General Security Concepts > Explain the importance of change man..., 651, 0.004677, claude-sonnet-4-20250514, null).',
  hint: null,
  message: 'new row for relation "questions" violates check constraint "check_has_topic"'
}
    ❌ Storage failed: new row for relation "questions" violates check constraint "check_has_topic"
    Generating: Bloom 2 - true_false
    ✅ Generated (471 tokens, $0.003153)
Error storing question: {
  code: '23514',
  details: 'Failing row contains (4ed26e93-becd-4052-a922-7e172233b196, null, 2, Dependency mapping is primarily used to identify which systems c..., true_false, null, True, This statement is true because dependency mapping serves to iden..., {"entityId":"50a72f25-d537-4c25-b767-0ce87620653d","entityName":..., easy, 0, null, 2025-11-14 23:57:38.363781+00, 2025-11-14 23:57:38.363781+00, null, null, null, ai_generated_graphrag, null, {}, {"primary": 1.0, "secondary": []}, null, true_false, {}, null, {}, {}, 50a72f25-d537-4c25-b767-0ce87620653d, Dependencies, General Security Concepts, General Security Concepts > Explain the importance of change man..., 471, 0.003153, claude-sonnet-4-20250514, null).',
  hint: null,
  message: 'new row for relation "questions" violates check constraint "check_has_topic"'
}
    ❌ Storage failed: new row for relation "questions" violates check constraint "check_has_topic"
    Generating: Bloom 3 - mcq_single
    ✅ Generated (714 tokens, $0.005730)
Error storing question: {
  code: '23514',
  details: 'Failing row contains (b98293e0-184a-47cf-948b-c2433649e38f, null, 3, A company is implementing a new authentication system that will ..., multiple_choice, ["A) Deploy the new authentication system in parallel with LDAP,..., A, Option A is correct because it demonstrates proper dependency ma..., {"entityId":"50a72f25-d537-4c25-b767-0ce87620653d","entityName":..., medium, 0, null, 2025-11-14 23:57:52.135115+00, 2025-11-14 23:57:52.135115+00, null, null, null, ai_generated_graphrag, null, {}, {"primary": 1.0, "secondary": []}, null, mcq_single, {}, null, {}, {}, 50a72f25-d537-4c25-b767-0ce87620653d, Dependencies, General Security Concepts, General Security Concepts > Explain the importance of change man..., 714, 0.005730, claude-sonnet-4-20250514, null).',
  hint: null,
  message: 'new row for relation "questions" violates check constraint "check_has_topic"'
}
    ❌ Storage failed: new row for relation "questions" violates check constraint "check_has_topic"
    Generating: Bloom 3 - true_false
    ✅ Generated (458 tokens, $0.003030)
Error storing question: {
  code: '23514',
  details: 'Failing row contains (032ab89b-22e3-4646-a510-31e49cfea56b, null, 3, When implementing a database encryption upgrade, dependency mapp..., true_false, null, True, This statement is true because dependency mapping identifies all..., {"entityId":"50a72f25-d537-4c25-b767-0ce87620653d","entityName":..., medium, 0, null, 2025-11-14 23:58:01.389068+00, 2025-11-14 23:58:01.389068+00, null, null, null, ai_generated_graphrag, null, {}, {"primary": 1.0, "secondary": []}, null, true_false, {}, null, {}, {}, 50a72f25-d537-4c25-b767-0ce87620653d, Dependencies, General Security Concepts, General Security Concepts > Explain the importance of change man..., 458, 0.003030, claude-sonnet-4-20250514, null).',
  hint: null,
  message: 'new row for relation "questions" violates check constraint "check_has_topic"'
}
    ❌ Storage failed: new row for relation "questions" violates check constraint "check_has_topic"
Progress saved to test-questions-cryptography.json

️  Pausing 3000ms before next batch...

────────────────────────────────────────────────────────────────────────────────
Batch 2/2 (Entities 6-10)

  Entity: Blockchain (Topic)
    Generating: Bloom 2 - mcq_single
    ✅ Generated (756 tokens, $0.005868)
Error storing question: {
  code: '23514',
  details: `Failing row contains (da16e2d7-60c5-4567-be69-09402f799bf8, null, 2, Which of the following best explains how blockchain technology a..., multiple_choice, ["A) Each block contains a cryptographic hash of the previous bl..., A, Option A correctly explains blockchain's tamper resistance mecha..., {"entityId":"7bb3bec7-3334-4a14-8f89-9cccda8defd9","entityName":..., easy, 0, null, 2025-11-14 23:58:16.353037+00, 2025-11-14 23:58:16.353037+00, null, null, null, ai_generated_graphrag, null, {}, {"primary": 1.0, "secondary": []}, null, mcq_single, {}, null, {}, {}, 7bb3bec7-3334-4a14-8f89-9cccda8defd9, Blockchain, General Security Concepts, General Security Concepts > Explain the importance of using appr..., 756, 0.005868, claude-sonnet-4-20250514, null).`,
  hint: null,
  message: 'new row for relation "questions" violates check constraint "check_has_topic"'
}
    ❌ Storage failed: new row for relation "questions" violates check constraint "check_has_topic"
    Generating: Bloom 2 - true_false
    ✅ Generated (530 tokens, $0.003654)
Error storing question: {
  code: '23514',
  details: `Failing row contains (62180fb3-540a-44df-a5ee-759cd1b2fd71, null, 2, Blockchain technology achieves immutability by cryptographically..., true_false, null, True, This statement is true because blockchain's core security mechan..., {"entityId":"7bb3bec7-3334-4a14-8f89-9cccda8defd9","entityName":..., easy, 0, null, 2025-11-14 23:58:26.006051+00, 2025-11-14 23:58:26.006051+00, null, null, null, ai_generated_graphrag, null, {}, {"primary": 1.0, "secondary": []}, null, true_false, {}, null, {}, {}, 7bb3bec7-3334-4a14-8f89-9cccda8defd9, Blockchain, General Security Concepts, General Security Concepts > Explain the importance of using appr..., 530, 0.003654, claude-sonnet-4-20250514, null).`,
  hint: null,
  message: 'new row for relation "questions" violates check constraint "check_has_topic"'
}
    ❌ Storage failed: new row for relation "questions" violates check constraint "check_has_topic"
    Generating: Bloom 3 - mcq_single
    ✅ Generated (756 tokens, $0.005976)
Error storing question: {
  code: '23514',
  details: 'Failing row contains (dca2468e-9c76-4f9e-b890-6585717cc54d, null, 3, A supply chain management company wants to implement blockchain ..., multiple_choice, ["A) Hash chaining between blocks to create an immutable audit t..., A, Option A is correct because hash chaining is the fundamental cry..., {"entityId":"7bb3bec7-3334-4a14-8f89-9cccda8defd9","entityName":..., medium, 0, null, 2025-11-14 23:58:38.675865+00, 2025-11-14 23:58:38.675865+00, null, null, null, ai_generated_graphrag, null, {}, {"primary": 1.0, "secondary": []}, null, mcq_single, {}, null, {}, {}, 7bb3bec7-3334-4a14-8f89-9cccda8defd9, Blockchain, General Security Concepts, General Security Concepts > Explain the importance of using appr..., 756, 0.005976, claude-sonnet-4-20250514, null).',
  hint: null,
  message: 'new row for relation "questions" violates check constraint "check_has_topic"'
}
    ❌ Storage failed: new row for relation "questions" violates check constraint "check_has_topic"
    Generating: Bloom 3 - true_false
    ✅ Generated (515 tokens, $0.003501)
Error storing question: {
  code: '23514',
  details: `Failing row contains (466f88db-2399-4ab9-bd8b-3fceae43209f, null, 3, A cybersecurity analyst implementing blockchain for supply chain..., true_false, null, True, This statement is true because blockchain's cryptographic archit..., {"entityId":"7bb3bec7-3334-4a14-8f89-9cccda8defd9","entityName":..., medium, 0, null, 2025-11-14 23:58:48.405039+00, 2025-11-14 23:58:48.405039+00, null, null, null, ai_generated_graphrag, null, {}, {"primary": 1.0, "secondary": []}, null, true_false, {}, null, {}, {}, 7bb3bec7-3334-4a14-8f89-9cccda8defd9, Blockchain, General Security Concepts, General Security Concepts > Explain the importance of using appr..., 515, 0.003501, claude-sonnet-4-20250514, null).`,
  hint: null,
  message: 'new row for relation "questions" violates check constraint "check_has_topic"'
}
    ❌ Storage failed: new row for relation "questions" violates check constraint "check_has_topic"

  Entity: Certificates (Topic)
    Generating: Bloom 2 - mcq_single
    ✅ Generated (1518 tokens, $0.008262)
Error storing question: {
  code: '23514',
  details: `Failing row contains (f1d9fa98-8dd9-4431-ab63-0a8ffc59a1c9, null, 2, A company's web administrator notices that their public website ..., multiple_choice, ["A) Certificate Revocation Lists (CRLs) downloaded periodically..., B, OCSP (Online Certificate Status Protocol) is correct because it ..., {"entityId":"960b8246-da31-44bf-b139-4848f37ad3e3","entityName":..., easy, 0, null, 2025-11-14 23:59:00.997541+00, 2025-11-14 23:59:00.997541+00, null, null, null, ai_generated_graphrag, null, {}, {"primary": 1.0, "secondary": []}, null, mcq_single, {}, null, {}, {}, 960b8246-da31-44bf-b139-4848f37ad3e3, Certificates, General Security Concepts, General Security Concepts > Explain the importance of using appr..., 1518, 0.008262, claude-sonnet-4-20250514, null).`,
  hint: null,
  message: 'new row for relation "questions" violates check constraint "check_has_topic"'
}
    ❌ Storage failed: new row for relation "questions" violates check constraint "check_has_topic"
    Generating: Bloom 2 - true_false
    ❌ Failed: Anthropic API error: 400 {"type":"error","error":{"type":"invalid_request_error","message":"Your credit balance is too low to access the Anthropic API. Please go to Plans & Billing to upgrade or purchase credits."},"request_id":"req_011CV8gxzjRWwZpgxgyLisPN"}
    Generating: Bloom 3 - mcq_single
    ❌ Failed: Anthropic API error: 400 {"type":"error","error":{"type":"invalid_request_error","message":"Your credit balance is too low to access the Anthropic API. Please go to Plans & Billing to upgrade or purchase credits."},"request_id":"req_011CV8gy9aEYmqWhAyQ5HbF5"}
    Generating: Bloom 3 - true_false
    ❌ Failed: Anthropic API error: 400 {"type":"error","error":{"type":"invalid_request_error","message":"Your credit balance is too low to access the Anthropic API. Please go to Plans & Billing to upgrade or purchase credits."},"request_id":"req_011CV8gyK4VoZ1D7jvaQy2nG"}

  Entity: Certificate authorities (Subtopic)
    Generating: Bloom 2 - mcq_single
    ❌ Failed: Anthropic API error: 400 {"type":"error","error":{"type":"invalid_request_error","message":"Your credit balance is too low to access the Anthropic API. Please go to Plans & Billing to upgrade or purchase credits."},"request_id":"req_011CV8gyTjduHJwbZJC2RQ9d"}
    Generating: Bloom 2 - true_false
    ❌ Failed: Anthropic API error: 400 {"type":"error","error":{"type":"invalid_request_error","message":"Your credit balance is too low to access the Anthropic API. Please go to Plans & Billing to upgrade or purchase credits."},"request_id":"req_011CV8gycaCQxkJCjFN8rSpJ"}
    Generating: Bloom 3 - mcq_single
    ❌ Failed: Anthropic API error: 400 {"type":"error","error":{"type":"invalid_request_error","message":"Your credit balance is too low to access the Anthropic API. Please go to Plans & Billing to upgrade or purchase credits."},"request_id":"req_011CV8gynVkef7cEryQ6UjYE"}
    Generating: Bloom 3 - true_false
    ❌ Failed: Anthropic API error: 400 {"type":"error","error":{"type":"invalid_request_error","message":"Your credit balance is too low to access the Anthropic API. Please go to Plans & Billing to upgrade or purchase credits."},"request_id":"req_011CV8gywM4JoH2W7oEfo4a1"}

  Entity: Certificate revocation lists (CRLs) (Subtopic)
    Generating: Bloom 2 - mcq_single
    ❌ Failed: Anthropic API error: 400 {"type":"error","error":{"type":"invalid_request_error","message":"Your credit balance is too low to access the Anthropic API. Please go to Plans & Billing to upgrade or purchase credits."},"request_id":"req_011CV8gz5fs6RtDhY7k43Aqj"}
    Generating: Bloom 2 - true_false
    ❌ Failed: Anthropic API error: 400 {"type":"error","error":{"type":"invalid_request_error","message":"Your credit balance is too low to access the Anthropic API. Please go to Plans & Billing to upgrade or purchase credits."},"request_id":"req_011CV8gzGsKC8LqALUg7nX24"}
    Generating: Bloom 3 - mcq_single
    ❌ Failed: Anthropic API error: 400 {"type":"error","error":{"type":"invalid_request_error","message":"Your credit balance is too low to access the Anthropic API. Please go to Plans & Billing to upgrade or purchase credits."},"request_id":"req_011CV8gzSGrnUrHgjp3X99WL"}
    Generating: Bloom 3 - true_false
    ❌ Failed: Anthropic API error: 400 {"type":"error","error":{"type":"invalid_request_error","message":"Your credit balance is too low to access the Anthropic API. Please go to Plans & Billing to upgrade or purchase credits."},"request_id":"req_011CV8gzbUVrj7yZ7MPeG3Bq"}

  Entity: Certificate signing request (CSR) generation (Subtopic)
    Generating: Bloom 2 - mcq_single
    ❌ Failed: Anthropic API error: 400 {"type":"error","error":{"type":"invalid_request_error","message":"Your credit balance is too low to access the Anthropic API. Please go to Plans & Billing to upgrade or purchase credits."},"request_id":"req_011CV8gzkmqmijAgftjpmA6S"}
    Generating: Bloom 2 - true_false
    ❌ Failed: Anthropic API error: 400 {"type":"error","error":{"type":"invalid_request_error","message":"Your credit balance is too low to access the Anthropic API. Please go to Plans & Billing to upgrade or purchase credits."},"request_id":"req_011CV8gzw2jY19QXYjcFmwN9"}
    Generating: Bloom 3 - mcq_single
    ❌ Failed: Anthropic API error: 400 {"type":"error","error":{"type":"invalid_request_error","message":"Your credit balance is too low to access the Anthropic API. Please go to Plans & Billing to upgrade or purchase credits."},"request_id":"req_011CV8h16VWKWYUmK1rDciMd"}
    Generating: Bloom 3 - true_false
    ❌ Failed: Anthropic API error: 400 {"type":"error","error":{"type":"invalid_request_error","message":"Your credit balance is too low to access the Anthropic API. Please go to Plans & Billing to upgrade or purchase credits."},"request_id":"req_011CV8h1FYxYsmswwYCmxRQY"}
Progress saved to test-questions-cryptography.json


================================================================================
Batch Generation Complete
================================================================================

📊 Summary:
   Total Entities: 10
   Total Questions: 40
   Successful: 0 (0%)
   Failed: 15 (38%)
   Duplicates: 0

💰 Cost:
   Total Tokens: 18,141
   Total Cost: $0.1182
   Avg Cost per Question: $Infinity

️  Performance:
   Duration: 309s (5 minutes)
   Questions/minute: 8
Progress saved to test-questions-cryptography.json

💾 Results saved to: test-questions-cryptography.json

================================================================================

✅ Cryptography Topics (Bloom 2-3) complete: 0/40 questions

️  Pausing 5s before next category...


================================================================================
Generating: Network Security Topics (Bloom 2-3)
================================================================================

================================================================================
Batch Question Generation
================================================================================

 Step 1: Retrieving entities...
Fetching entities for scope tag: network-security
✅ Found 10 entities to process

🤖 Step 2: Generating questions...

────────────────────────────────────────────────────────────────────────────────
Batch 1/2 (Entities 1-5)

  Entity: Security Control Categories (Topic)
    Generating: Bloom 2 - mcq_single
    ❌ Failed: Anthropic API error: 400 {"type":"error","error":{"type":"invalid_request_error","message":"Your credit balance is too low to access the Anthropic API. Please go to Plans & Billing to upgrade or purchase credits."},"request_id":"req_011CV8h1w2GSseL9S16Z4Pqc"}
    Generating: Bloom 2 - mcq_multi
    ❌ Failed: Anthropic API error: 400 {"type":"error","error":{"type":"invalid_request_error","message":"Your credit balance is too low to access the Anthropic API. Please go to Plans & Billing to upgrade or purchase credits."},"request_id":"req_011CV8h26NLi4kc5w8d8SSm2"}
    Generating: Bloom 3 - mcq_single
    ❌ Failed: Anthropic API error: 400 {"type":"error","error":{"type":"invalid_request_error","message":"Your credit balance is too low to access the Anthropic API. Please go to Plans & Billing to upgrade or purchase credits."},"request_id":"req_011CV8h2FM5vG9F7cYKp9f6H"}
    Generating: Bloom 3 - mcq_multi
    ❌ Failed: Anthropic API error: 400 {"type":"error","error":{"type":"invalid_request_error","message":"Your credit balance is too low to access the Anthropic API. Please go to Plans & Billing to upgrade or purchase credits."},"request_id":"req_011CV8h2QitxTPhN2Pi85XCt"}

  Entity: Physical (Subtopic)
    Generating: Bloom 2 - mcq_single
    ❌ Failed: Anthropic API error: 400 {"type":"error","error":{"type":"invalid_request_error","message":"Your credit balance is too low to access the Anthropic API. Please go to Plans & Billing to upgrade or purchase credits."},"request_id":"req_011CV8h2ZeApdyquF1jUgXte"}
    Generating: Bloom 2 - mcq_multi
    ❌ Failed: Anthropic API error: 400 {"type":"error","error":{"type":"invalid_request_error","message":"Your credit balance is too low to access the Anthropic API. Please go to Plans & Billing to upgrade or purchase credits."},"request_id":"req_011CV8h2irJyXPhmun4f4SiR"}
    Generating: Bloom 3 - mcq_single
    ❌ Failed: Anthropic API error: 400 {"type":"error","error":{"type":"invalid_request_error","message":"Your credit balance is too low to access the Anthropic API. Please go to Plans & Billing to upgrade or purchase credits."},"request_id":"req_011CV8h2sj7GxyC9A3G48L8s"}
    Generating: Bloom 3 - mcq_multi
    ❌ Failed: Anthropic API error: 400 {"type":"error","error":{"type":"invalid_request_error","message":"Your credit balance is too low to access the Anthropic API. Please go to Plans & Billing to upgrade or purchase credits."},"request_id":"req_011CV8h34YUqp6ECigZj46k8"}

  Entity: Technical (Subtopic)
    Generating: Bloom 2 - mcq_single
    ❌ Failed: Anthropic API error: 400 {"type":"error","error":{"type":"invalid_request_error","message":"Your credit balance is too low to access the Anthropic API. Please go to Plans & Billing to upgrade or purchase credits."},"request_id":"req_011CV8h3DXEQWo3v15vQ9eWu"}
    Generating: Bloom 2 - mcq_multi
    ❌ Failed: Anthropic API error: 400 {"type":"error","error":{"type":"invalid_request_error","message":"Your credit balance is too low to access the Anthropic API. Please go to Plans & Billing to upgrade or purchase credits."},"request_id":"req_011CV8h3PM5S5mdAcmUm7otT"}
    Generating: Bloom 3 - mcq_single
    ❌ Failed: Anthropic API error: 400 {"type":"error","error":{"type":"invalid_request_error","message":"Your credit balance is too low to access the Anthropic API. Please go to Plans & Billing to upgrade or purchase credits."},"request_id":"req_011CV8h3Y6BmsCXK6mmFJdbX"}
    Generating: Bloom 3 - mcq_multi
    ❌ Failed: Anthropic API error: 400 {"type":"error","error":{"type":"invalid_request_error","message":"Your credit balance is too low to access the Anthropic API. Please go to Plans & Billing to upgrade or purchase credits."},"request_id":"req_011CV8h3i5hsd42UcxZXQ5Q4"}

  Entity: Security Control types (Topic)
    Generating: Bloom 2 - mcq_single
    ❌ Failed: Anthropic API error: 400 {"type":"error","error":{"type":"invalid_request_error","message":"Your credit balance is too low to access the Anthropic API. Please go to Plans & Billing to upgrade or purchase credits."},"request_id":"req_011CV8h3sbwgpyqeHnwR1CFq"}
    Generating: Bloom 2 - mcq_multi
    ❌ Failed: Anthropic API error: 400 {"type":"error","error":{"type":"invalid_request_error","message":"Your credit balance is too low to access the Anthropic API. Please go to Plans & Billing to upgrade or purchase credits."},"request_id":"req_011CV8h41fNWBAXF3pvmdscX"}
    Generating: Bloom 3 - mcq_single
    ❌ Failed: Anthropic API error: 400 {"type":"error","error":{"type":"invalid_request_error","message":"Your credit balance is too low to access the Anthropic API. Please go to Plans & Billing to upgrade or purchase credits."},"request_id":"req_011CV8h4BLYRM47caoTCKPYf"}
    Generating: Bloom 3 - mcq_multi
    ❌ Failed: Anthropic API error: 400 {"type":"error","error":{"type":"invalid_request_error","message":"Your credit balance is too low to access the Anthropic API. Please go to Plans & Billing to upgrade or purchase credits."},"request_id":"req_011CV8h4LvFWnaqy7UwsK8n8"}

  Entity: Compensating (Subtopic)
    Generating: Bloom 2 - mcq_single
    ❌ Failed: Anthropic API error: 400 {"type":"error","error":{"type":"invalid_request_error","message":"Your credit balance is too low to access the Anthropic API. Please go to Plans & Billing to upgrade or purchase credits."},"request_id":"req_011CV8h4ZrdDBmBsFnXGC5TT"}
    Generating: Bloom 2 - mcq_multi
    ❌ Failed: Anthropic API error: 400 {"type":"error","error":{"type":"invalid_request_error","message":"Your credit balance is too low to access the Anthropic API. Please go to Plans & Billing to upgrade or purchase credits."},"request_id":"req_011CV8h4menvJmM3RJ92h9Gk"}
    Generating: Bloom 3 - mcq_single
    ❌ Failed: Anthropic API error: 400 {"type":"error","error":{"type":"invalid_request_error","message":"Your credit balance is too low to access the Anthropic API. Please go to Plans & Billing to upgrade or purchase credits."},"request_id":"req_011CV8h4viVqXdpHma5odhYU"}
    Generating: Bloom 3 - mcq_multi
    ❌ Failed: Anthropic API error: 400 {"type":"error","error":{"type":"invalid_request_error","message":"Your credit balance is too low to access the Anthropic API. Please go to Plans & Billing to upgrade or purchase credits."},"request_id":"req_011CV8h55eGVwmyGmeoFaXNf"}
Progress saved to test-questions-network.json

️  Pausing 3000ms before next batch...

────────────────────────────────────────────────────────────────────────────────
Batch 2/2 (Entities 6-10)

  Entity: Preventive (Subtopic)
    Generating: Bloom 2 - mcq_single
    ❌ Failed: Anthropic API error: 400 {"type":"error","error":{"type":"invalid_request_error","message":"Your credit balance is too low to access the Anthropic API. Please go to Plans & Billing to upgrade or purchase credits."},"request_id":"req_011CV8h5U5eDPQMPtcs4Gcmy"}
    Generating: Bloom 2 - mcq_multi
    ❌ Failed: Anthropic API error: 400 {"type":"error","error":{"type":"invalid_request_error","message":"Your credit balance is too low to access the Anthropic API. Please go to Plans & Billing to upgrade or purchase credits."},"request_id":"req_011CV8h5d5NhwPMrj7Ywvedz"}
    Generating: Bloom 3 - mcq_single
    ❌ Failed: Anthropic API error: 400 {"type":"error","error":{"type":"invalid_request_error","message":"Your credit balance is too low to access the Anthropic API. Please go to Plans & Billing to upgrade or purchase credits."},"request_id":"req_011CV8h5mmG5hXk8vaaNBQJo"}
    Generating: Bloom 3 - mcq_multi
    ❌ Failed: Anthropic API error: 400 {"type":"error","error":{"type":"invalid_request_error","message":"Your credit balance is too low to access the Anthropic API. Please go to Plans & Billing to upgrade or purchase credits."},"request_id":"req_011CV8h5wQSrgaG1JswinAyj"}

  Entity: Business processes impacting security operation (Topic)
    Generating: Bloom 2 - mcq_single
    ❌ Failed: Anthropic API error: 400 {"type":"error","error":{"type":"invalid_request_error","message":"Your credit balance is too low to access the Anthropic API. Please go to Plans & Billing to upgrade or purchase credits."},"request_id":"req_011CV8h6Am7tg6anpyUKcsMW"}
    Generating: Bloom 2 - mcq_multi
    ❌ Failed: Anthropic API error: 400 {"type":"error","error":{"type":"invalid_request_error","message":"Your credit balance is too low to access the Anthropic API. Please go to Plans & Billing to upgrade or purchase credits."},"request_id":"req_011CV8h6JtXPTS8P2Aj5BUau"}
    Generating: Bloom 3 - mcq_single
    ❌ Failed: Anthropic API error: 400 {"type":"error","error":{"type":"invalid_request_error","message":"Your credit balance is too low to access the Anthropic API. Please go to Plans & Billing to upgrade or purchase credits."},"request_id":"req_011CV8h6TWCBQjVjQSHnXidj"}
    Generating: Bloom 3 - mcq_multi
    ❌ Failed: Anthropic API error: 400 {"type":"error","error":{"type":"invalid_request_error","message":"Your credit balance is too low to access the Anthropic API. Please go to Plans & Billing to upgrade or purchase credits."},"request_id":"req_011CV8h6dF5HMQ5289XM7MUN"}

  Entity: Approval process (Subtopic)
    Generating: Bloom 2 - mcq_single
    ❌ Failed: Anthropic API error: 400 {"type":"error","error":{"type":"invalid_request_error","message":"Your credit balance is too low to access the Anthropic API. Please go to Plans & Billing to upgrade or purchase credits."},"request_id":"req_011CV8h6nWSZ4sqFyrjrdBJD"}
    Generating: Bloom 2 - mcq_multi
    ❌ Failed: Anthropic API error: 400 {"type":"error","error":{"type":"invalid_request_error","message":"Your credit balance is too low to access the Anthropic API. Please go to Plans & Billing to upgrade or purchase credits."},"request_id":"req_011CV8h6wXut6ir7U2TFqrAq"}
    Generating: Bloom 3 - mcq_single
    ❌ Failed: Anthropic API error: 400 {"type":"error","error":{"type":"invalid_request_error","message":"Your credit balance is too low to access the Anthropic API. Please go to Plans & Billing to upgrade or purchase credits."},"request_id":"req_011CV8h76ywHxZJAngezX8Dj"}
    Generating: Bloom 3 - mcq_multi
    ❌ Failed: Anthropic API error: 400 {"type":"error","error":{"type":"invalid_request_error","message":"Your credit balance is too low to access the Anthropic API. Please go to Plans & Billing to upgrade or purchase credits."},"request_id":"req_011CV8h7G3ty1Lw68bvrh5sF"}

  Entity: Backout plan (Subtopic)
    Generating: Bloom 2 - mcq_single
    ❌ Failed: Anthropic API error: 400 {"type":"error","error":{"type":"invalid_request_error","message":"Your credit balance is too low to access the Anthropic API. Please go to Plans & Billing to upgrade or purchase credits."},"request_id":"req_011CV8h7RJWWPXjM89CFrkiq"}
    Generating: Bloom 2 - mcq_multi
    ❌ Failed: Anthropic API error: 400 {"type":"error","error":{"type":"invalid_request_error","message":"Your credit balance is too low to access the Anthropic API. Please go to Plans & Billing to upgrade or purchase credits."},"request_id":"req_011CV8h7ak3NkjiWjxBBw4DD"}
    Generating: Bloom 3 - mcq_single
    ❌ Failed: Anthropic API error: 400 {"type":"error","error":{"type":"invalid_request_error","message":"Your credit balance is too low to access the Anthropic API. Please go to Plans & Billing to upgrade or purchase credits."},"request_id":"req_011CV8h7jvwBXcUe8hh7oT3j"}
    Generating: Bloom 3 - mcq_multi
    ❌ Failed: Anthropic API error: 400 {"type":"error","error":{"type":"invalid_request_error","message":"Your credit balance is too low to access the Anthropic API. Please go to Plans & Billing to upgrade or purchase credits."},"request_id":"req_011CV8h7tb5zoHZ284ejZUpW"}

  Entity: Impact analysis (Subtopic)
    Generating: Bloom 2 - mcq_single
    ❌ Failed: Anthropic API error: 400 {"type":"error","error":{"type":"invalid_request_error","message":"Your credit balance is too low to access the Anthropic API. Please go to Plans & Billing to upgrade or purchase credits."},"request_id":"req_011CV8h83iGNyM5nCPcDHAxe"}
    Generating: Bloom 2 - mcq_multi
    ❌ Failed: Anthropic API error: 400 {"type":"error","error":{"type":"invalid_request_error","message":"Your credit balance is too low to access the Anthropic API. Please go to Plans & Billing to upgrade or purchase credits."},"request_id":"req_011CV8h8D27JqZp5YupiGefq"}
    Generating: Bloom 3 - mcq_single
    ❌ Failed: Anthropic API error: 400 {"type":"error","error":{"type":"invalid_request_error","message":"Your credit balance is too low to access the Anthropic API. Please go to Plans & Billing to upgrade or purchase credits."},"request_id":"req_011CV8h8NNRtXSjgotjTdiTF"}
    Generating: Bloom 3 - mcq_multi
    ❌ Failed: Anthropic API error: 400 {"type":"error","error":{"type":"invalid_request_error","message":"Your credit balance is too low to access the Anthropic API. Please go to Plans & Billing to upgrade or purchase credits."},"request_id":"req_011CV8h8YHjTgMtHgLnRtYHg"}
Progress saved to test-questions-network.json


================================================================================
Batch Generation Complete
================================================================================

📊 Summary:
   Total Entities: 10
   Total Questions: 40
   Successful: 0 (0%)
   Failed: 40 (100%)
   Duplicates: 0

💰 Cost:
   Total Tokens: 0
   Total Cost: $0.0000
   Avg Cost per Question: $NaN

️  Performance:
   Duration: 94s (2 minutes)
   Questions/minute: 26
Progress saved to test-questions-network.json

💾 Results saved to: test-questions-network.json

================================================================================

✅ Network Security Topics (Bloom 2-3) complete: 0/40 questions

️  Pausing 5s before next category...


================================================================================
Generating: Incident Response Topics (Bloom 3-4)
================================================================================

================================================================================
Batch Question Generation
================================================================================

 Step 1: Retrieving entities...
Fetching entities for scope tag: incident-response
✅ Found 5 entities to process

🤖 Step 2: Generating questions...

────────────────────────────────────────────────────────────────────────────────
Batch 1/1 (Entities 1-5)

  Entity: Managerial (Subtopic)
    Generating: Bloom 3 - mcq_multi
    ❌ Failed: Anthropic API error: 400 {"type":"error","error":{"type":"invalid_request_error","message":"Your credit balance is too low to access the Anthropic API. Please go to Plans & Billing to upgrade or purchase credits."},"request_id":"req_011CV8h9Dg5Fb83J874iCzdJ"}
    Generating: Bloom 3 - true_false
    ❌ Failed: Anthropic API error: 400 {"type":"error","error":{"type":"invalid_request_error","message":"Your credit balance is too low to access the Anthropic API. Please go to Plans & Billing to upgrade or purchase credits."},"request_id":"req_011CV8h9Q7t1SerfQq43rKqb"}
    Generating: Bloom 4 - mcq_multi
    ❌ Failed: Anthropic API error: 400 {"type":"error","error":{"type":"invalid_request_error","message":"Your credit balance is too low to access the Anthropic API. Please go to Plans & Billing to upgrade or purchase credits."},"request_id":"req_011CV8h9ZYQkXcD8pgpQcnEQ"}
    Generating: Bloom 4 - true_false
    ❌ Failed: Anthropic API error: 400 {"type":"error","error":{"type":"invalid_request_error","message":"Your credit balance is too low to access the Anthropic API. Please go to Plans & Billing to upgrade or purchase credits."},"request_id":"req_011CV8h9innGqcNSdX6BE8x3"}

  Entity: Security Control types (Topic)
    Generating: Bloom 3 - mcq_multi
    ❌ Failed: Anthropic API error: 400 {"type":"error","error":{"type":"invalid_request_error","message":"Your credit balance is too low to access the Anthropic API. Please go to Plans & Billing to upgrade or purchase credits."},"request_id":"req_011CV8h9t8cRvBoTx55yQdtE"}
    Generating: Bloom 3 - true_false
    ❌ Failed: Anthropic API error: 400 {"type":"error","error":{"type":"invalid_request_error","message":"Your credit balance is too low to access the Anthropic API. Please go to Plans & Billing to upgrade or purchase credits."},"request_id":"req_011CV8hA377Nqhsx12Zhc3KV"}
    Generating: Bloom 4 - mcq_multi
    ❌ Failed: Anthropic API error: 400 {"type":"error","error":{"type":"invalid_request_error","message":"Your credit balance is too low to access the Anthropic API. Please go to Plans & Billing to upgrade or purchase credits."},"request_id":"req_011CV8hADSDFicuvRnwSTLUL"}
    Generating: Bloom 4 - true_false
    ❌ Failed: Anthropic API error: 400 {"type":"error","error":{"type":"invalid_request_error","message":"Your credit balance is too low to access the Anthropic API. Please go to Plans & Billing to upgrade or purchase credits."},"request_id":"req_011CV8hANo2v9QQ7AbkEPkTF"}

  Entity: Corrective (Subtopic)
    Generating: Bloom 3 - mcq_multi
    ❌ Failed: Anthropic API error: 400 {"type":"error","error":{"type":"invalid_request_error","message":"Your credit balance is too low to access the Anthropic API. Please go to Plans & Billing to upgrade or purchase credits."},"request_id":"req_011CV8hAXFGvCs37SjkD4RsG"}
    Generating: Bloom 3 - true_false
    ❌ Failed: Anthropic API error: 400 {"type":"error","error":{"type":"invalid_request_error","message":"Your credit balance is too low to access the Anthropic API. Please go to Plans & Billing to upgrade or purchase credits."},"request_id":"req_011CV8hAgYNfyHpqtKK4x54J"}
    Generating: Bloom 4 - mcq_multi
    ❌ Failed: Anthropic API error: 400 {"type":"error","error":{"type":"invalid_request_error","message":"Your credit balance is too low to access the Anthropic API. Please go to Plans & Billing to upgrade or purchase credits."},"request_id":"req_011CV8hAqnVo2NAFCAhnUnyW"}
    Generating: Bloom 4 - true_false
    ❌ Failed: Anthropic API error: 400 {"type":"error","error":{"type":"invalid_request_error","message":"Your credit balance is too low to access the Anthropic API. Please go to Plans & Billing to upgrade or purchase credits."},"request_id":"req_011CV8hB1mmS8H8ErEUoFzdV"}

  Entity: Detective (Subtopic)
    Generating: Bloom 3 - mcq_multi
    ❌ Failed: Anthropic API error: 400 {"type":"error","error":{"type":"invalid_request_error","message":"Your credit balance is too low to access the Anthropic API. Please go to Plans & Billing to upgrade or purchase credits."},"request_id":"req_011CV8hBBURXKSEwrtPFXUFD"}
    Generating: Bloom 3 - true_false
    ❌ Failed: Anthropic API error: 400 {"type":"error","error":{"type":"invalid_request_error","message":"Your credit balance is too low to access the Anthropic API. Please go to Plans & Billing to upgrade or purchase credits."},"request_id":"req_011CV8hBM9LiN7ekaGzDcjjQ"}
    Generating: Bloom 4 - mcq_multi
    ❌ Failed: Anthropic API error: 400 {"type":"error","error":{"type":"invalid_request_error","message":"Your credit balance is too low to access the Anthropic API. Please go to Plans & Billing to upgrade or purchase credits."},"request_id":"req_011CV8hBWzBPTSdtqtN3xpob"}
    Generating: Bloom 4 - true_false
    ❌ Failed: Anthropic API error: 400 {"type":"error","error":{"type":"invalid_request_error","message":"Your credit balance is too low to access the Anthropic API. Please go to Plans & Billing to upgrade or purchase credits."},"request_id":"req_011CV8hBgUw5KnHFAv3EQ3WJ"}

  Entity: Preventive (Subtopic)
    Generating: Bloom 3 - mcq_multi
    ❌ Failed: Anthropic API error: 400 {"type":"error","error":{"type":"invalid_request_error","message":"Your credit balance is too low to access the Anthropic API. Please go to Plans & Billing to upgrade or purchase credits."},"request_id":"req_011CV8hBrJHPTTjTRSyh7D5x"}
    Generating: Bloom 3 - true_false
    ❌ Failed: Anthropic API error: 400 {"type":"error","error":{"type":"invalid_request_error","message":"Your credit balance is too low to access the Anthropic API. Please go to Plans & Billing to upgrade or purchase credits."},"request_id":"req_011CV8hC1ShdHX6xJYor2qwx"}
    Generating: Bloom 4 - mcq_multi
    ❌ Failed: Anthropic API error: 400 {"type":"error","error":{"type":"invalid_request_error","message":"Your credit balance is too low to access the Anthropic API. Please go to Plans & Billing to upgrade or purchase credits."},"request_id":"req_011CV8hCAtESErn5Bxc5cYQ7"}
    Generating: Bloom 4 - true_false
    ❌ Failed: Anthropic API error: 400 {"type":"error","error":{"type":"invalid_request_error","message":"Your credit balance is too low to access the Anthropic API. Please go to Plans & Billing to upgrade or purchase credits."},"request_id":"req_011CV8hCLC4vdCAF9e3YxnTb"}
Progress saved to test-questions-incident-response.json


================================================================================
Batch Generation Complete
================================================================================

📊 Summary:
   Total Entities: 5
   Total Questions: 20
   Successful: 0 (0%)
   Failed: 20 (100%)
   Duplicates: 0

💰 Cost:
   Total Tokens: 0
   Total Cost: $0.0000
   Avg Cost per Question: $NaN

️  Performance:
   Duration: 46s (1 minutes)
   Questions/minute: 26
Progress saved to test-questions-incident-response.json

💾 Results saved to: test-questions-incident-response.json

================================================================================

✅ Incident Response Topics (Bloom 3-4) complete: 0/20 questions

️  Pausing 5s before next category...


================================================================================
Test Set Generation Complete
================================================================================

📊 Overall Summary:
   Total Questions: 100
   Successful: 0 (0%)
   Failed: 75 (75%)
   Total Cost: $0.1182

 Output Files:
   - test-questions-cryptography.json
   - test-questions-network.json
   - test-questions-incident-response.json

✅ Test set ready for QA review and testing!
================================================================================

